{
  "event_id": "qubit-2022-01-27-bridge-validation-gap",
  "tx_hash": "0x478d83f2ad909c64a9a3d807b3d8399bb67a997f9721fc5580ae2c51fab92acf",
  "chain": "ethereum",
  "fork_block": 14094937,
  "involved_protocols": ["Qubit Finance", "QBridge"],
  "involved_mechanisms": ["validation-gap", "mint", "borrow"],
  "profit_usd": 80000000,
  "victim_set": ["Qubit-QBridge-Ethereum-locked-token-depositors"],
  "event_type": "exploit",
  "disclosure_date": "2022-01-28",
  "subset_class": "M",
  "classification_rationale": "The QBridge deposit() function on Ethereum contains a validation-gap: it uses a modified safeTransferFrom() that calls() the zero address token contract directly, which succeeds silently because the zero address has no code. This allows the attacker to call deposit() with 0 ETH, triggering an event that the BSC relayer accepts as proof of deposit, and minting 216,960 qXETH on BSC to borrow $80M of assets. The entire exploit relies on the validation-gap in the bridge's input checking, not on basic action composition.",
  "sources": [
    {"kind": "rekt", "url": "https://rekt.news/qubit-rekt/"},
    {"kind": "other", "url": "https://medium.com/@QubitFin/porotocol-exploit-report-3-82f4e3ade34b"}
  ]
}
