{
  "event_id": "saddle-2022-04-30-metapool-flashloan",
  "tx_hash": "0x2b023d65485c4bb68d781960c2196588d03b871dc9eb1c054f596b7ca6f7da56",
  "chain": "ethereum",
  "fork_block": 14684300,
  "involved_protocols": ["Saddle Finance"],
  "involved_mechanisms": ["flashloan", "swap", "add-liquidity", "remove-liquidity"],
  "profit_usd": 10000000,
  "victim_set": ["Saddle-Finance-sUSD-metapool-LPs"],
  "event_type": "exploit",
  "disclosure_date": "2022-04-30",
  "subset_class": "B",
  "classification_rationale": "",
  "sources": [
    {"kind": "other", "url": "https://medium.com/immunefi/hack-analysis-saddle-finance-april-2022-f2bcb119f38"},
    {"kind": "rekt", "url": "https://rekt.news/saddle-finance-rekt/"}
  ]
}
