{
  "event_id": "transit-swap-2022-10-02-approval-exploit",
  "tx_hash": "0x181a7882aac0eab1036eedba25bc95a16e10f61b5df2e99d240a16c334b9b189",
  "chain": "bsc",
  "fork_block": 22015100,
  "involved_protocols": ["Transit Swap"],
  "involved_mechanisms": ["flashloan", "swap", "transfer", "approval-abuse"],
  "profit_usd": 21000000,
  "victim_set": ["Transit-Swap-approved-users"],
  "event_type": "exploit",
  "disclosure_date": "2022-10-02",
  "subset_class": "B",
  "classification_rationale": "",
  "sources": [
    {"kind": "slowmist", "url": "https://slowmist.medium.com/cross-chain-dex-aggregator-transit-swap-hacked-analysis-74ba39c22020"},
    {"kind": "rekt", "url": "https://rekt.news/transit-swap-rekt/"}
  ]
}
