{
  "event_id": "popsicle-2021-08-04-fee-accounting-gap",
  "tx_hash": "0xcd7dae143a4c0223349c16237ce4cd7696b1638d116a72755231ede872ab70fc",
  "chain": "ethereum",
  "fork_block": 12963999,
  "involved_protocols": ["Popsicle Finance"],
  "involved_mechanisms": ["accounting-window", "validation-gap", "deposit", "transfer"],
  "profit_usd": 20700000,
  "victim_set": ["Popsicle-Finance-Sorbetto-Fragola-pool-LPs"],
  "event_type": "exploit",
  "disclosure_date": "2021-08-04",
  "subset_class": "B",
  "classification_rationale": "",
  "sources": [
    {"kind": "other", "url": "https://blocksecteam.medium.com/the-analysis-of-the-popsicle-finance-security-incident-9d9d5a3045c1"},
    {"kind": "rekt", "url": "https://rekt.news/popsicle-rekt/"}
  ]
}
