{
  "event_id": "uniswap-2021-10-27-cream-flashloan",
  "tx_hash": "0x0fe2542079644e107cbf13690eb9c2c65963ccb79089ff96bfaf8dced2331c92",
  "chain": "ethereum",
  "fork_block": 13537084,
  "involved_protocols": ["Uniswap", "Aave"],
  "involved_mechanisms": ["flashloan", "swap", "deposit", "borrow", "yETH-reentrancy"],
  "profit_usd": 130000000,
  "victim_set": ["Cream-Finance-v1-lending-pools"],
  "event_type": "exploit",
  "disclosure_date": "2021-10-27",
  "subset_class": "B",
  "classification_rationale": "",
  "sources": [
    {"kind": "rekt", "url": "https://rekt.news/cream-rekt-2/"},
    {"kind": "defihacklabs", "url": "https://github.com/SunWeb3Sec/DeFiHackLabs/blob/main/src/test/2021-10/Cream_exp.sol"}
  ]
}
