{
  "event_id": "rari-fuse-2022-04-30-exitmarket-reentrancy",
  "tx_hash": "0xab486012f21be741c9e674ffda227e30518e8a1e37a5f1d58d0b0d41f6e76530",
  "chain": "ethereum",
  "fork_block": 14686787,
  "involved_protocols": ["Rari Capital", "Fei Protocol"],
  "involved_mechanisms": ["flashloan", "validation-gap", "reentrancy", "borrow", "liquidate"],
  "profit_usd": 80000000,
  "victim_set": ["Rari-Fuse-pool-8", "Rari-Fuse-pool-18", "Rari-Fuse-pool-27", "Rari-Fuse-pool-127"],
  "event_type": "exploit",
  "disclosure_date": "2022-04-30",
  "subset_class": "M",
  "classification_rationale": "Rari Fuse protected most functions with a reentrancy lock but left a validation-gap: exitMarket() was never protected, allowing the attacker to call it inside the ETH .call.value() fallback reentrancy path triggered during borrowETH repayment. By calling exitMarket() while the global reentrancy lock is active, the attacker removes collateral-market membership and exits with both collateral and borrowed ETH. The validation-gap in the lifecycle of the comptroller's market-membership check is the mechanism-level exploit.",
  "sources": [
    {"kind": "rekt", "url": "https://rekt.news/fei-rari-rekt/"},
    {"kind": "other", "url": "https://medium.com/@JackLongarzo/fuse-exploit-post-mortem-76ce18d8974"}
  ]
}
