{
  "event_id": "uniswap-2022-06-16-inverse-flashloan",
  "tx_hash": "0x958236266991bc3fe3b77feaacea120f172c0708ad01c7a715b255f218f9313c",
  "chain": "ethereum",
  "fork_block": 14986087,
  "involved_protocols": ["Uniswap"],
  "involved_mechanisms": ["flashloan", "swap", "borrow", "keep3r-oracle-manipulation"],
  "profit_usd": 1200000,
  "victim_set": ["Inverse-Finance-DOLA-market"],
  "event_type": "exploit",
  "disclosure_date": "2022-06-16",
  "subset_class": "B",
  "classification_rationale": "",
  "sources": [
    {"kind": "rekt", "url": "https://rekt.news/inverse-finance-rekt2/"},
    {"kind": "defihacklabs", "url": "https://github.com/SunWeb3Sec/DeFiHackLabs/blob/main/src/test/2022-06/inversefinance_exp.sol"}
  ]
}
