{
  "event_id": "inverse-2022-04-02-inv-twap-manip",
  "tx_hash": "0x20a6dcff06a791a7f8be9f423053ce8caee3f9eecc31df32445fc98d4ccd8365",
  "chain": "ethereum",
  "fork_block": 14506357,
  "involved_protocols": ["Inverse Finance", "SushiSwap", "Curve Finance"],
  "involved_mechanisms": ["swap", "oracle-coupling", "numerical-invariant", "borrow"],
  "profit_usd": 15600000,
  "victim_set": ["Inverse-Finance-Anchor-market-lenders"],
  "event_type": "exploit",
  "disclosure_date": "2022-04-02",
  "subset_class": "M",
  "classification_rationale": "Attacker manipulates the Keep3r TWAP oracle that Inverse Finance uses to value INV collateral. The oracle-coupling between the Keep3r TWAP and the Anchor lending invariant is the mechanism exploited: by purchasing INV across SushiSwap and Curve with 500 ETH of own funds over multiple blocks, the attacker moves the TWAP to a value 5x fair market, then borrows 1588 ETH + 94 WBTC + 3.9M DOLA against inflated collateral. No flash loan was used; the vulnerability is in the oracle-coupling mechanism itself.",
  "sources": [
    {"kind": "rekt", "url": "https://rekt.news/inverse-rekt/"},
    {"kind": "other", "url": "https://www.certik.com/resources/blog/inverse-finance-02-april-2022"}
  ]
}
