{
  "event_id": "visor-2021-12-21-reentrancy",
  "tx_hash": "0x69272d8c84d67d1da2f6425b339192fa472898dce936f24818fda415c1c1ff3f",
  "chain": "ethereum",
  "fork_block": 13830000,
  "involved_protocols": ["Visor Finance", "Uniswap"],
  "involved_mechanisms": ["flashloan", "reentrancy", "deposit", "withdraw"],
  "profit_usd": 8200000,
  "victim_set": ["Visor-Finance-vVISR-staking-vault"],
  "event_type": "exploit",
  "disclosure_date": "2021-12-21",
  "subset_class": "B",
  "classification_rationale": "",
  "sources": [
    {"kind": "defihacklabs", "url": "https://github.com/SunWeb3Sec/DeFiHackLabs/blob/main/src/test/2021-12/Visor_exp.sol"},
    {"kind": "rekt", "url": "https://rekt.news/visor-finance-rekt/"}
  ]
}
