{
  "event_id": "harvest-2020-10-26-share-price-manip",
  "tx_hash": "0x35f8d2f572fceaac9288e5d462117850ef2694786992a8c3f6d02612277b0877",
  "chain": "ethereum",
  "fork_block": 11129473,
  "involved_protocols": ["Harvest Finance", "Curve Finance", "Uniswap"],
  "involved_mechanisms": ["flashloan", "swap", "share-asset-pricing", "deposit", "withdraw"],
  "profit_usd": 24000000,
  "victim_set": ["Harvest-fUSDC-vault-LPs", "Harvest-fUSDT-vault-LPs"],
  "event_type": "exploit",
  "disclosure_date": "2020-10-26",
  "subset_class": "mixed",
  "classification_rationale": "Exploit combines basic swap actions (flashloan + USDC/USDT swaps to move Curve 3pool price) with a share-asset-pricing mechanism vulnerability: Harvest vault calculates share value from the live Curve LP price, so the attacker buys vault shares cheaply when the manipulated pool undervalues the underlying, then exits after restoring the price. The share-asset-pricing invariant is directly exploited; basic swap actions provide the price distortion.",
  "sources": [
    {"kind": "slowmist", "url": "https://slowmist.medium.com/slow-mist-analysis-of-harvest-finances-hacked-event-63450b49e6a5"},
    {"kind": "rekt", "url": "https://rekt.news/harvest-finance-rekt/"}
  ]
}
