{
  "event_id": "penpie-2024-09-04-sy-reentrancy",
  "tx_hash": "0x7e7f9548f301d3dd863eac94e6190cb742ab6aa9d7730549ff743bf84cbd21d1",
  "chain": "ethereum",
  "fork_block": 20683573,
  "involved_protocols": ["Penpie", "Pendle Finance", "Balancer"],
  "involved_mechanisms": ["flashloan", "lifecycle-hook", "reentrancy", "structural-layering", "deposit"],
  "profit_usd": 27000000,
  "victim_set": ["Penpie-vlPNP-stakers", "Penpie-staking-pool-depositors"],
  "event_type": "exploit",
  "disclosure_date": "2024-09-04",
  "subset_class": "M",
  "classification_rationale": "Attacker exploits a lifecycle-hook reentrancy in Penpie's _harvestBatchMarketRewards() which calls an external SY contract to claim rewards. By deploying a malicious SY contract as a Pendle market and depositing flash-loaned funds, the attacker re-enters Penpie's reward distribution before state is updated. The structural-layering between Pendle's open market creation and Penpie's reward-claim hook enables the attack: without the SY callback lifecycle-hook the reentrancy path is unavailable.",
  "sources": [
    {"kind": "slowmist", "url": "https://slowmist.medium.com/slowmist-incident-analysis-penpie-hack-e6157975898f"},
    {"kind": "rekt", "url": "https://rekt.news/penpie-rekt/"}
  ]
}
