{
  "event_id": "curve-2023-07-30-vyper-reentrancy",
  "tx_hash": "0xa84aa065ce61dbb1eb50ab6ae67fc31a9da50dd2c74eefd561661bfce2f1620c",
  "chain": "ethereum",
  "fork_block": 17806560,
  "involved_protocols": ["Curve Finance"],
  "involved_mechanisms": ["reentrancy", "remove-liquidity", "swap"],
  "profit_usd": 70000000,
  "victim_set": ["Curve-alETH-ETH-pool", "Curve-pETH-ETH-pool", "Curve-msETH-ETH-pool", "Curve-CRV-ETH-pool"],
  "event_type": "exploit",
  "disclosure_date": "2023-07-30",
  "subset_class": "B",
  "classification_rationale": "",
  "sources": [
    {"kind": "rekt", "url": "https://rekt.news/curve-pools-rekt/"},
    {"kind": "defihacklabs", "url": "https://github.com/SunWeb3Sec/DeFiHackLabs/blob/main/src/test/2023-07/Curve_exp.sol"}
  ]
}
