{
  "event_id": "elephant-2022-04-12-price-manipulation",
  "tx_hash": "0xec317deb2f3efdc1dbf7ed5d3902cdf2c33ae512151646383a8cf8cbcd3d4577",
  "chain": "bsc",
  "fork_block": 17027500,
  "involved_protocols": ["Elephant Money", "PancakeSwap"],
  "involved_mechanisms": ["flashloan", "swap", "borrow", "oracle-price-manipulation"],
  "profit_usd": 11200000,
  "victim_set": ["Elephant-Money-ELEPHANT-stakers"],
  "event_type": "exploit",
  "disclosure_date": "2022-04-12",
  "subset_class": "B",
  "classification_rationale": "",
  "sources": [
    {"kind": "defihacklabs", "url": "https://github.com/SunWeb3Sec/DeFiHackLabs/blob/main/src/test/2022-04/ElephantMoney_exp.sol"},
    {"kind": "slowmist", "url": "https://slowmist.medium.com/an-analysis-of-elephant-money-attack-9aff8690d3a1"}
  ]
}
