{
  "event_id": "pickle-2020-11-21-evil-jar",
  "tx_hash": "0xe72d4e7ba9b5af0cf2a8cfb1e30fd9f388df0ab3da79790be842bfbed11087b0",
  "chain": "ethereum",
  "fork_block": 11305876,
  "involved_protocols": ["Pickle Finance", "Curve Finance", "Compound"],
  "involved_mechanisms": ["validation-gap", "delegate-call", "withdraw", "swap"],
  "profit_usd": 19700000,
  "victim_set": ["Pickle-pDAI-Jar-depositors"],
  "event_type": "exploit",
  "disclosure_date": "2020-11-21",
  "subset_class": "mixed",
  "classification_rationale": "Attacker exploits a validation-gap in ControllerV4.swapExactJarForJar() which fails to verify that the input Jar contracts are legitimate protocol Jars. An Evil Jar contract is passed as both _fromJar and _toJar, triggering a delegatecall into CurveProxyLogic that drains cDAI from the Controller. Basic withdraw/swap actions follow after the initial validation-gap is triggered.",
  "sources": [
    {"kind": "other", "url": "https://github.com/banteg/evil-jar"},
    {"kind": "rekt", "url": "https://rekt.news/pickle-finance-rekt/"}
  ]
}
