{
  "event_id": "pancakeswap-2022-09-14-network-exp",
  "tx_hash": "0x3a4b6ab473c4a9e1af7f57f27b57cfe36e1e3b16de4e1f73bb05eeb0e6561f85",
  "chain": "bsc",
  "fork_block": 21299162,
  "involved_protocols": ["PancakeSwap"],
  "involved_mechanisms": ["flashloan", "swap", "add-liquidity", "remove-liquidity"],
  "profit_usd": 2400000,
  "victim_set": ["PancakeSwap-BNB-CAKE-pool"],
  "event_type": "exploit",
  "disclosure_date": "2022-09-14",
  "subset_class": "B",
  "classification_rationale": "",
  "sources": [
    {"kind": "defihacklabs", "url": "https://github.com/SunWeb3Sec/DeFiHackLabs/blob/main/src/test/2022-09/Network_exp.sol"},
    {"kind": "slowmist", "url": "https://slowmist.medium.com/analysis-of-network-token-attack-incident-c2cf6d1fdf2f"}
  ]
}
