{
  "event_id": "bzx-2020-02-15-oracle-margin-pump",
  "tx_hash": "0xb5c8bd9430b6cc87a0e2fe110ece6bf527fa4f170a4bc8cd032f768fc5219838",
  "chain": "ethereum",
  "fork_block": 9484687,
  "involved_protocols": ["bZx", "dYdX", "Uniswap", "Compound"],
  "involved_mechanisms": ["flashloan", "margin-trade", "share-asset-pricing", "oracle-coupling"],
  "profit_usd": 370000,
  "victim_set": ["bZx-protocol-lenders"],
  "event_type": "exploit",
  "disclosure_date": "2020-02-17",
  "subset_class": "M",
  "classification_rationale": "Exploit specifically targets the share-asset-pricing mechanism in bZx's iToken: by opening a large margin position via the protocol's internal pToken/iToken accounting, the attacker manipulates the Uniswap WBTC/ETH pool depth so that bZx's collateral valuation oracle returns an inflated value. The vulnerability is in the oracle-coupling between the AMM spot price and the bZx lending invariant, not merely in swap parameters.",
  "sources": [
    {"kind": "other", "url": "https://peckshield.medium.com/bzx-hack-full-disclosure-with-detailed-profit-analysis-e6b1fa9b18fc"},
    {"kind": "other", "url": "https://www.palkeo.com/en/projets/ethereum/bzx.html"}
  ]
}
