{
  "event_id": "sushiswap-2023-04-09-routeprocessor2",
  "tx_hash": "0xb8f57cf82b7057d9d03f1500e3f0ce46980388c3b13ff317f1c617d932313386",
  "chain": "ethereum",
  "fork_block": 17027847,
  "involved_protocols": ["SushiSwap"],
  "involved_mechanisms": ["validation-gap", "callback-exploit", "swap", "transfer"],
  "profit_usd": 3300000,
  "victim_set": ["SushiSwap-RouteProcessor2-approved-users"],
  "event_type": "exploit",
  "disclosure_date": "2023-04-09",
  "subset_class": "mixed",
  "classification_rationale": "RouteProcessor2.processRoute() has a validation-gap: it does not verify that the pool field is a legitimate Uniswap V3 pool address, so a malicious contract passed as pool receives the IUniswapV3Pool.swap() callback. Inside that callback the attacker calls uniswapV3SwapCallback() with crafted data, draining ERC-20 tokens from any user who approved RouteProcessor2. Basic swap and transfer actions follow the validation-gap callback to extract funds from victim wallets.",
  "sources": [
    {"kind": "rekt", "url": "https://rekt.news/sushi-yoink-rekt/"},
    {"kind": "other", "url": "https://www.sushi.com/blog/routeprocessor2-post-mortem"}
  ]
}
