{
  "event_id": "rari-capital-2021-05-08-reentrancy",
  "tx_hash": "0x171072422efb5cd461546bfe986017d9b5aa427ff1c07ebe8acc064b13a7b7be",
  "chain": "ethereum",
  "fork_block": 12392000,
  "involved_protocols": ["Rari Capital", "Alpha Finance"],
  "involved_mechanisms": ["flashloan", "reentrancy", "borrow", "withdraw"],
  "profit_usd": 11000000,
  "victim_set": ["Rari-Capital-ETH-pool-depositors"],
  "event_type": "exploit",
  "disclosure_date": "2021-05-08",
  "subset_class": "B",
  "classification_rationale": "",
  "sources": [
    {"kind": "defihacklabs", "url": "https://github.com/SunWeb3Sec/DeFiHackLabs/blob/main/src/test/2021-05/RariCapital_exp.sol"},
    {"kind": "rekt", "url": "https://rekt.news/rari-capital-rekt/"}
  ]
}
