{
  "event_id": "uniswap-2021-05-05-xtoken-flashloan",
  "tx_hash": "0x7cc7d935d895980cdd905b2a134597b94128a3d2aef05774ea8e189d27da2c38",
  "chain": "ethereum",
  "fork_block": 12379757,
  "involved_protocols": ["Uniswap", "Aave"],
  "involved_mechanisms": ["flashloan", "swap", "borrow", "oracle-spot-manipulation"],
  "profit_usd": 25000000,
  "victim_set": ["xToken-xSNXa-pool", "xToken-xBNTa-pool"],
  "event_type": "exploit",
  "disclosure_date": "2021-05-12",
  "subset_class": "B",
  "classification_rationale": "",
  "sources": [
    {"kind": "rekt", "url": "https://rekt.news/xtoken-rekt/"},
    {"kind": "defihacklabs", "url": "https://github.com/SunWeb3Sec/DeFiHackLabs/blob/main/src/test/2021-05/xToken_exp.sol"}
  ]
}
